,flair,title
901,Social Science,Neutralizing misinformation through inoculation: Exposing misleading argumentation techniques reduces their influence
902,Disease,A prototype early warning system for the four most common types of cancer makes a visible mole appear on the skin when calcium levels indicate a tumor has developed.
903,Psychology,"Frequent childhood nightmares may indicate an increased risk of psychotic traits: Children who suffer from frequent nightmares or bouts of night terrors may be at an increased risk of psychotic experiences in adolescence, according to new research"
904,Medicine,Cannabinoid THC restores cognitive function in old mice
905,Neuroscience,"Neurons in the brain that produce the pleasure-signaling neurotransmitter dopamine also directly control the brain's circadian center, or ""body clock"", new research finds"
906,Disease,"A professor at the University of South Carolina studied medieval skeletons from the period before, during and after the Black Death. She found people who survived the plague lived much longer lives than people did before it struck."
907,Social Science,"DVD Release Delays Boost Piracy and Hurt Sales, Study Shows"
908,Medicine,"A recommendation to eat or skip breakfast has no discernible effect on weight loss ""contrary to widely espoused views"""
909,Neuroscience,"Researchers have created an artificial synapse capable of learning autonomously. They were also able to model the device, which is essential for developing more complex circuits. The research was published in Nature Communications today."
910,Environment,"IPCC Report Warns of Food Shortages, Conflicts Due to Climate Change. “We’re not in an era where climate change is some sort of future hypothetical,” Field told reporters on Sunday. “There is no question that we live in a world that’s already altered by climate change.”"
911,Biology,"A skull found in Montana, US belongs to the earliest known horned dinosaur species in North America"
912,Psychology,Perceived intelligence is associated with measured intelligence in men but not women. - Both men and women were able to accurately evaluate the intelligence of men by viewing facial photographs. No relationship between perceived intelligence and IQ was found for women.
913,Environment,Fetal and newborn dolphin deaths linked to Deepwater Horizon oil spill
914,Health,New evidence suggests nutritional labelling on menus may reduce our calorie intake
915,Animal Science,A new study explains how cephalopods are able to camouflage themselves in vivid colors despite being only able to see in black and white.
916,Medicine,"A malaria vaccine that uses a weakened form of the parasite has passed a ""critical milestone"" in human safety trials, say researchers."
917,Physical Science,Light-Powered Gyroscope is World’s Smallest: Promises a Powerful Spin on Navigation Technologies.
918,Health,"After a night of limited sleep, people consumed an average of 385 extra calories the next day"
919,Astronomy,Solar Storm Heading Toward Earth
920,Biology,"E-cigarette vapor damages the immune system of mice, study finds"
921,Health,Study shows the adolescent brain is particularly vulnerable to the negative effects of cannabis exposure
922,Health,A nearly 150 percent increase in US heroin use just six years - CDC via The Verge
923,Environment,"In the rapidly warming Arctic, regional hotspots may be altering mid-latitude weather patterns, causing the recent severe winters in North America and East Asia."
924,Biology,Consumer DNA Tests such as 23andMe and DNA Direct Are Wrong 40 Percent of the Time
925,Environment,"Dublin based start-up, Silicon Kingdom Holdings, in partnership with Arizona State University, to build carbon capture 'farms' capable of removing up to 4 million metric tons of carbon from the atmosphere per year, at a cost of less than $100 dollars per ton."
926,Psychology,"There's no such thing as tone deaf: Singing accurately is a learned skill that takes practice, with implications for how music is taught in schools"
927,Computer Science and Engineering,"Researchers have created Bat Bot, a fully self-contained, autonomous flying robot that weighs 93 grams."
928,Neuroscience,Neuron responsible for alcoholism found - could possibly lead to treatment of other addiction
929,Neuroscience,"Playing video games that involve physical exertion (exergaming) can improve executive function in children with attention-deficit/hyperactivity disorder (ADHD), suggests a new study."
930,Psychology,Feeling powerless increases the weight of the world… literally: New research shows that the more personally and socially powerless you feel the heavier objects appear to weigh
931,Animal Science,"Like human societies, whales value culture and family ties - ""Groundbreaking genetic kinship study of beluga whales"""
932,Animal Science,"Dolphins learn unusual hunting behavior from their friends, using giant snail shells to trap fish and then shaking the shells to dislodge the prey into their mouths. This is the second known case of marine mammals using tools."
933,Animal Science,Michigan's bald eagles are the most contaminated birds on the planet
934,Medicine,Parkinson's disease drugs 'are likely to turn more sufferers into sex and gambling addicts than previously feared'
935,Psychology,Psychologists fail to replicate well-known behaviour linked to learning : Nature News &amp; Comment
936,Physical Science,"A japanese research group has developed a molecular robot consisting of biomolecules, such as DNA and protein that can start and stop its shape-changing function in response to a specific DNA signal."
937,Physical Science,"Researchers develop method of drug testing for common drugs (e.g. cannabis, cocaine, heroin, amphetamines) in exhaled breath. The authors predict this method could have widespread uses from workplace to vehicular testing."
938,Physical Science,Geophysicists link fracking boom to increase in earthquakes
939,Physical Science,"Physicists have sent a beam of twisted light 3km through the air above Vienna. It is the first time that information has been transmitted outdoors using the ""twist"" of a visible light beam. Reported in the New Journal of Physics, the technique was tested by sending three images of famous Austrians."
940,Biology,New study shows climate change is wreaking havoc on delicate relationship between orchids and bees
941,Disease,"Mind the Fracking Data Gap, Study Says | The UT-Austin re-analysis found that there is 95 percent certainty that childhood leukemia rates are higher in Flower Mound, and that there is only a 1 in 20 chance that the possible elevated cancer rate there is a random occurrence."
942,Health,"Children as young as 4 who experience stress eat more in the absence of hunger, beginning a cycle that could possibly lead to excessive weight gain over time, increasing health risk."
943,Disease,'Universal cancer vaccine’ breakthrough claimed by scientists - Researchers have found a way to persuade the body's immune system to attack tumours – and it is largely free from side effects
944,Astronomy,Astronomers have found three potentially habitable exoplanets less than fifty light years from Earth
945,Environment,"One million species face extinction, U.N. panel says. And humans will suffer as a result."
946,Environment,"Climate change means more wildfires, and that means lots more air pollution | “The conditions we are experiencing right now are similar to what we would be seeing in August — that’s how dry it is,”"
947,Animal Science,"Old bonobos, like aging humans, suffer from long-sightedness and could use glasses. This suggests long-sightedness is not a product of modern lifestyles but a natural part of ageing."
948,Health,MDMA-Assisted Psychotherapy May Have Lasting Benefits for PTSD
949,Astronomy,As Many As Half of All Stars In The Universe Lie In The Space Between Galaxies
950,Medicine,Eye drops could clear up cataracts using newly identified chemical
951,Health,"""Giving Yourself A Break"" Could Add Years to Your LIfe"
952,Biology,"For the first time, researchers have demonstrated non-human animals are capable of engaging in ""bartering-like"" behavior. They show Norway rats trade services like grooming, and goods like food following principles of reciprocity."
953,Physical Science,"Composite metal foams (CMFs) are tough enough to turn an armor-piercing bullet into dust on impact. Given that these foams are also lighter than metal plating, the material has obvious implications for creating new types of body and vehicle armor."
954,Health,"Almost 40 percent of 16,000 ground zero rescue workers studied now have rheumatoid arthritis. Researchers determined WTC site workers are twice as likely to develop RA as controls, and the risk jumps by 13 percent for every additional month spent at ground zero."
955,Health,Commonly used reflux and ulcer medication may cause serious kidney damage. Proton pump inhibitors should be used only when necessary and should not be taken long-term.
956,Physical Science,"""So there was a little space around the far side of the Moon where I was shadowed from both the Earth and the Sun and that was pretty amazing. I could see more stars than I could possibly imagine. It really makes you wonder about our place in the Universe and what we’re all about."""
957,Psychology,"People who use the dating app Tinder despite being in a committed relationship tend to be more psychopathic, according to new research."
958,Environment,"Climate change related drought and extreme heat events slashed cereal harvests in recent decades by 9% to 10% on average in affected countries – and the impact of these weather disasters was greatest in the developed nations of North America, Europe and Australasia."
959,Health,The Happy Meal concept of offering a small incentive with a meal consistently motivates kids and adults to choose smaller portions
960,Physical Science,"The world's smallest diode, the size of a single molecule, has been developed."
961,Social Science,"25% of cancer survivors reported problems paying medical bills, CDC study finds"
962,Physical Science,Spanish Scientists Create Magnetic Wormhole | Physics
963,Health,"Sleep helps to repair damaged DNA in neurons, scientists find"
964,Biology,"Experimental Drug Prolongs Life Span in Mice: The rapidly aging mice fed the experimental drug lived more than four times longer than a control group, and their lungs and vascular system were protected from accelerated aging, the new study reports."
965,Computer Science and Engineering,Early 20th Century Earthquakes May Have Been Caused By Calif. Oil Boom
966,Social Science,"If you're rich, you're more lucky than smart. And there's math to prove it"
967,Neuroscience,"A new study adds more evidence against the idea of hypnopedia, or the ability to learn during sleep. While the brain is capable of hearing different sounds during sleep, the ability to accurately group these sounds into a sequence disappears, which may put a limit on the sophistication of lessons."
968,Health,Brain-Infecting 'Rat Lungworm' Spreads in Florida
969,Disease,"Scientists create white blood cells from stem cells obtained from donated liposuction and arm them to target and kill breast cancer cells. The white blood cells, mast cells, act as a ""trojan horse"" to deliver pre-stored anti-tumor mediators to the breast cancer cells. Immunotherapy at its finest."
970,Psychology,Being true to yourself may protect against the harmful effects of loneliness
971,Health,Algorithm Predicts if Twitter Users Are Becoming Mentally Ill
972,Medicine,"Haruko Obokata, the lead researcher behind the paper suggesting stem cells could be made by dipping adult cells in mild acid, has been found guilty of scientific misconduct."
973,Astronomy,Betelgeuse is too cool for current theories to explain how it sheds mass as it approaches death
974,Animal Science,"Rhesus monkeys are aware of the limits of their knowledge, new research shows. Findings suggest evidence of metacognition, long been considered a hallmark of being human, that offers proof that monkeys quickly recognize, on the spot, when a new problem requires information they don't have."
975,Health,"Living close to nature and spending time outside has wide-ranging health benefits - Exposure to greenspace reduces the risk of type II diabetes, cardiovascular disease, premature death, preterm birth, stress, and high blood pressure, suggests 143 studies involving over 290 million people."
976,Biology,"Tobacco plants transformed into ‘green bioreactors’ to produce an anti-inflammatory protein called Interleukin 37, produced in the human kidney, the first to demonstrate that functional human protein can be produced in tobacco plant cells, which is much more affordable than current pharma methods."
977,Medicine,Hydroxynorketamine: New rapid-acting antidepressant without the side effects of ketamine
978,Medicine,"Modified virus as ""Trojan Horse"" for delivering genes to repair congenital hearing loss for the very first time in a mouse model, by researchers from Harvard Medical School And MedUni Vienna, published in ""Nature Biotechnology""."
979,Biology,Team succeeds in producing photoreceptors from human embryonic stem cells
980,Physical Science,The seventh row of the periodic table is now full
981,Environment,"After analyzing pre- and post-mining topographic data in southern West Virginia, researchers determined that some parts of Central Appalachia are 60 percent flatter than they were prior to excavation."
982,Animal Science,Fish With Creepy Curved Backbones Could Help Explain Scoliosis
983,Health,"Drinking will shorten your life, according to a major new study that suggests every glass of wine or pint of beer over the daily recommended limit will cut half an hour from the expected lifespan of a 40 year old."
984,Disease,"New study finds that, in the hour following moderate consumption of alcohol, the risk of heart attack and stroke nearly doubles"
985,Medicine,"A robot helped doctors carry out the world’s first remote heart surgery from 20 miles away on five patients, a “milestone” development, according to a study in The Lancet’s EClinicalMedicine. The technology could be deployed “as a front-line service in regions where such expertise is not available.”"
986,Health,Sugar-sweetened beverages suppress body’s stress response
987,Environment,"Environmental records shattered as climate change 'plays out before us'. Temperatures, sea levels and carbon dioxide all hit milestones amid extreme weather in 2015, major international ‘state of the climate’ report finds"
988,Computer Science and Engineering,"Solar greenhouses generate electricity and grow crops at the same time, study reveals - Magenta panes also help plants save water"
989,Environment,"Annual spikes in mercury along the California coastline have been puzzling scientists for over two decades. Now, researchers think they know what's causing these toxic increases: the fur of molting elephant seals."
990,Physical Science,"A new study shows that iron-bearing rocks that formed at the ocean floor 3.2 billion years ago carry unmistakable evidence of oxygen. The only logical source for that oxygen is the earliest known example of photosynthesis by living organisms, say geoscientists."
991,Disease,Benzodiazepines Linked to Treatment Resistant Depression
992,Neuroscience,High levels of moral reasoning correspond with increased gray matter in brain
993,Biology,This New Bandage Can Suck Bacteria Out Of A Wound
994,Environment,"Floods as war weapons: From 1500 until 2000, about a third of floods in southwestern Netherlands were deliberately caused by humans during wartimes, new research shows."
995,Animal Science,Bizarre ant colony discovered in an abandoned Polish nuclear weapons bunker
996,Social Science,"Almost 40% of people aged 65 to 80 are sexually active, but few are open about it"
997,Psychology,Arguing Too Much Increases Premature Death Risk: Study
998,Health,7 bee species listed as endangered for the first time in U.S.
999,Medicine,"Natural painkiller nasal spray could replace addictive opioids, trial indicates. Scientists alleviated pain in animals with a nasal spray that delivered millions of soluble nanoparticles filled with a natural opioid directly to the brain, that is tolerance free, leading to lower risks of overdoses."
1000,Animal Science,"It's not just a grunt: Pigs really do have something to say - The grunts made by pigs vary depending on the pig's personality and can convey important information about the welfare of this highly social species, new research has found."
1001,Social Science,"Study of 11 million Craigslist rental listings reveals rent burden in US metropolitan housing markets, and significant compression of rents in affordable markets"
1002,Animal Science,Endangered cave-dwelling fish species discovered in Brazil
1003,Social Science,Recent breakthroughs in DNA testing of prehistoric European humans detail their origins and disprove that there were ever “pure Europeans”
1004,Animal Science,Dog-speak is important for developing a social bond with your pet new research shows
1005,Environment,"Atmospheric carbon last year reached levels not seen in 800,000 years, according to a new report by NOAA."
1006,Environment,"As mercury emissions drop, so do concentrations in tuna. Tuna remains the largest source of mercury consumption by Americans, despite warnings from public health officials to limit tuna intake."
1007,Neuroscience,"Nerve transfer surgery has enabled 13 young adults with complete paralysis to regain movement and function in their elbows and hands. This is according to the largest case series of this technique in people with tetraplegia (paralysis of both the upper and lower limbs), published in The Lancet."
1008,Biology,"The Zebra stripes may prevent the flies from landing, and could have been one the evolutionary drivers of the zebra pattern. Scientist provided further evidence to this hypothesis looking at horse flies behaviour around zebras and uniformly coloured domestic horses."
1009,Environment,"Rain or shine: new solar cell captures energy from raindrops | When raindrops fall on to the layers and then roll off, the friction generates a static electricity charge."
1010,Psychology,Lithium level in tap water has an inverse association with depressive symptoms and violence
1011,Computer Science and Engineering,Researchers have managed to make the first Skype call on a battery-free phone
1012,Animal Science,"Mysterious Type Of Killer Whale, Sought After For Years, Found In Southern Ocean"
1013,Social Science,"Scientists solve 2,000-year-old mystery of the binding media in China's polychrome Terracotta Army"
1014,Computer Science and Engineering,This new exoskeleton slips on like a boot and makes steps 7% more efficient -- without using any power source. It relies on a spring system (based on leg muscle physiology) to give walkers a boost. Tests of the device are reported in a new Nature article.
1015,Biology,Crickets evolved silence in ~20 years to escape parasitic fly
1016,Environment,US scientists: Global warming pause 'no longer valid' - BBC News
1017,Physical Science,"Researchers have found a way to make ultralight sponge-like materials from nanoscale ceramic fibers. The highly porous, compressible and heat-resistant sponges could have numerous uses, from water purification devices to flexible insulating materials."
1018,Biology,"New study suggests free radicals may actually slow down aging, by causing damaged cells to commit suicide"
1019,Disease,Fall in ovarian cancer deaths worldwide linked to contraceptive pill use
1020,Environment,Fertilizer produces far more greenhouse gas than expected
1021,Health,Study finds no link between cycling helmet laws and head injury rates
1022,Computer Science and Engineering,"A team used 3D printing to make rubber robotic fingers with feedback sensors composed of a conductive gel. When the researchers manipulated the fingers, the sensors supplied data on each finger’s orientation, and detected contact with other surfaces."
1023,Psychology,"By passively monitoring user-generated data from medical cannabis patients, researchers have glimpsed the types and amounts of marijuana that seem effective for relieving symptoms of stress, anxiety, and depression, as reported in the Journal of Affective Disorders."
1024,Physical Science,2015 Nobel Prize in Physics: Detection of Neutrino Oscillation
1025,Astronomy,Scientists Have Discovered Hundreds of Galaxies Hiding Behind the Milky Way
1026,Medicine,A pilot study of 12 young children (aged 5-8) with Type 1 diabetes found that an artificial pancreas (smartphone with wireless blood sugar monitor and insulin pump without need to stick fingers) helped study participants better control their condition compared to their usual insulin pump.
1027,Environment,"Asheville researchers connect dots of climate change. “It really doesn’t matter whether you believe the science or not if your insurance company is saying it’s going to cost more to live in a house on the coast,”"
1028,Psychology,The first results from psychology’s largest reproducibility test show that only 39 of 100 major published psychology studies could be reproduced
1029,Psychology,"Overclaiming one’s own knowledge predicts anti-establishment voting, particularly at the radical right."
1030,Astronomy,"19,000-pound space station falling ‘uncontrolled’ back to earth"
1031,Animal Science,Pigeons dodge city traffic by folding their wings into strategic positions that minimize altitude and energy loss in different situations.
1032,Health,"Less than seven hours of sleep is ""inadequate to sustain health and safety in adults,"" according to a new study."
1033,Physical Science,"Scientists have developed a sensitive chemical sensor based on an optical fiber, which could be potentially used for real-time detection of heavy organic contaminants such as herbicides or pesticides in water."
1034,Animal Science,Researchers have discovered that birds can sleep in flight. They measured the brain activity of frigatebirds and found that they sleep in flight with either one cerebral hemisphere at a time or both hemispheres simultaneously
1035,Biology,"An international team reveals that human genome could contain up to 20% fewer genes, suggesting that humans may have only 19,000 coding genes, 3,000 fewer than the sum of the three reference annotations of the human genome and a much lower number than the 100,000 predicted just twenty years ago."
1036,Physical Science,"Don’t throw out old, sprouting garlic — it has heart-healthy antioxidants: “Sprouted” garlic is considered to be past its prime and usually ends up in the garbage can. But scientists report that this type of garlic has even more heart-healthy antioxidant activity than its fresher counterparts"
1037,Environment,Ice Age engravings found at Jersey archaeological site
1038,Biology,New species of ancient tropical flower found in amber from the Dominican Republic
1039,Computer Science and Engineering,Stretchy Artificial 'Skin' Could Give Robots a Sense of Touch
1040,Psychology,"When moral outrage goes viral, it can come across as bullying - Stanford psychologists find that when online comments pile up against an individual’s questionable behavior, people are more likely to see it as bullying and start to feel sympathy for the offender."
1041,Computer Science and Engineering,Robotic suit gives shipyard workers super-strength
1042,Physical Science,"Stanford researchers have set a new record in efficiency for storing solar energy by capturing and storing 30% of the energy captured from sunlight into stored hydrogen fuel, beating the previous record of 24.4%."
1043,Disease,Scientists develop handheld mass spectrometry system for rapidly and accurately identifying cancerous tissue during surgery. The instrument can provide diagnostic information about what tissue to cut or preserve in as little as 10 seconds.
1044,Disease,"Foreclosures Drive up Suicide Rate: The recent U.S. foreclosure crisis contributed significantly to the nation’s jump in suicides, independent of other economic factors associated with the Great Recession, according to a new study"
1045,Physical Science,"Yes, physicists are building a super efficient nano-engine. But here’s why it DOESN’T break the Carnot Limit and all of Thermodynamics."
1046,Neuroscience,"Cannabidiol (CBD) , a chemical found in cannabis might just be the answer to preventing Alzheimer's."
1047,Medicine,"Science AMA Series: I'm Susan Nagel, I Study the Endocrine Effects of Fracking Chemicals and BPA, AMA!"
1048,Astronomy,NASA discovers molecular hydrogen in habitable ocean environment on Saturn’s moon Enceladus
1049,Disease,"Guns, drugs, and car crashes account for half of US life expectancy gap compared to other high-income countries"
1050,Astronomy,Planets in chaos: the discovery of thousands of star systems wildly different from our own has demolished ideas about how planets form. Astronomers are searching for a whole new theory
1051,Psychology,"Origins of narcissism in children: ""These findings show that narcissism is partly rooted in early socialization experiences"""
1052,Health,"Successful weight reduction and maintenance by using a smartphone app in those who are overweight or obese, with effects more significant for individuals who monitored their weight and diet more frequently, as found by Korean researchers based on a study of 35,921 participants."
1053,Physical Science,Cheap plastic film prevents batteries from catching fire: researchers added a heat-sensitive polymer sheet to conventional lithium-ion batteries that shuts down their operation if the temperature rises too high.
1054,Psychology,Researchers predict with high accuracy if antidepressants will help
