,flair,title
1767,Physical Science,Deforestation has stopped in wealthy countries. Europe’s forest area grew by more than 0.3% annually from 1990 to 2015. In the United States it is growing by 0.1% annually.
1768,Health,"Ketogenic Diets Have ""Profound Effect on Brain Function"": '... two new studies published in Cell Metabolism show how cutting back carbohydrates and intermittent fasting not only helps with weight, but may stretch out your life while improving your memory along the way - in mice, at least.'"
1769,Environment,"Summer thunderstorms in North America will likely be larger, wetter and more frequent in a warmer world, dumping 80 percent more rain in some areas and worsening flooding, a new study says."
1770,Psychology,Caffeine could remedy unethical behavior by sleep-deprived workers: Lack of sleep can lead to unethical behavior in the workplace but the equivalent of a large cup of coffee can help sleep-deprived employees bolster their ability to control their behavior and resist unethical temptations
1771,Neuroscience,Birth of new brain cells might erase babies’ memories
1772,Neuroscience,[Neuro] Gene deletion mutation found to increase empathy: Variation five times more common in Canadians than Rwandans
1773,Physical Science,"University of Colorado Boulder researchers have developed nanobio-hybrid organisms capable of using airborne carbon dioxide and nitrogen to produce a variety of plastics and fuels, a promising first step toward low-cost carbon sequestration"
1774,Environment,"Fracking's Wastewater, Poorly Understood, Is Analyzed for First Time. Researchers identified 25 inorganic chemicals in the waste. Of those, at least six were found at levels that would make the water unsafe to drink"
1775,Biology,"In FASEB Journal today: Serotonin, oxytocin, and vasopressin, three brain hormones that affect social behavior, are all activated by vitamin D hormone. Relevance for autism."
1776,Physical Science,China is building world's largest supercollider - over twice the size of the Large Hadron Collider
1777,Medicine,Yale researchers beat untreatable eczema with arthritis drug
1778,Physical Science,July 2017 was the hottest month in recorded human history
1779,Health,Study finds menstrual cups be have greater risk of toxic shock syndrome versus current tampon brands due to air being inserted along with cup and biofilm surviving rinsing. Recommendations to reduce risk are to use a second cup and boil between uses.
1780,Psychology,New research finds that heterosexual people with pathological personalities have better success finding mates
1781,Biology,"A fungal parasite that infects ants and manipulates their behavior to benefit the fungus' reproduction accomplishes this feat without infecting the ants' brains. It surrounds and invades muscle fibers throughout the ant's body, and fungal cells form a 3D network to control host behavior"
1782,Social Science,"Neanderthals' lack of drawing ability may relate to hunting techniques: Spear-throwing gave Homo sapiens better eye-hand coordination, smarter brains, UC Davis study suggests"
1783,Health,"Poverty is “consistently and reliably” associated with inflammation in childhood, finds a new study based on meta-analysis, providing evidence that lower childhood socioeconomic status was associated with higher levels of chronic inflammation."
1784,Neuroscience,First study of LSD with modern neuroimaging helps define its hallucinatory quality
1785,Medicine,Many People Taking Antidepressants Discover They Cannot Quit and May have Developed Dependencies They Were Not Adequately Warner About.
1786,Medicine,Herpes Vaccine Could Be On Market Within A Year
1787,Neuroscience,Sleep makes our memories more accessible
1788,Neuroscience,Birth Control May Alter the Structure of a Woman's Brain
1789,Psychology,"Pretending to Understand What Babies Say Can Make Them Smarter - ""New research suggests it’s how parents talk to their infants, not just how often, that makes a difference for language development."""
1790,Biology,"Future soldiers could be protected against germ warfare by genetically modified blood cells: Soldiers on future battlefields could be protected against germ warfare agents by having blood transfusions with genetically modified cells that can neutralise deadly biological toxins, scientists have found"
1791,Health,"Healthier School Lunch Rules Are Working, Study Finds."
1792,Neuroscience,"It is known that drinking alcohol can make people more aggressive, but new research suggests that aggression itself may also increase the subsequent consumption of alcohol."
1793,Psychology,"Up to five percent of perfectly healthy people suffer from a complete inability to enjoy music, researchers have found."
1794,Health,Autism’s Gut-Brain Connection: The different gut bacteria in autistic individuals may be contributing to the disorder.
1795,Medicine,"Panel of 11 genes predicts alcoholism risk, gives new insights into biology of the disease"
1796,Medicine,The myopia boom | Shortsightedness is reaching epidemic proportions. Some scientists think they have found a reason why.
1797,Physical Science,"Scientists have discovered a surprising material that is the best in the world at converting waste heat to useful electricity. This outstanding property could be exploited in solid-state thermoelectric devices in a variety of industries, with potentially enormous energy savings."
1798,Environment,"A new study shows that carbon released during the winter now outweighs the summertime gains, resulting in a net loss of carbon to the atmosphere suggesting the northern tundra may be shifting from its historical role as a carbon sink to a carbon source."
1799,Biology,"Researchers discovered species of dinosaur that represents the earliest known common ancestor of birds and closely related bird-like dinosaurs, with a feathering pattern associated with aerodynamics. It offers new insights into the evolution of feathers and flight."
1800,Medicine,"The effectiveness of antibiotics can be altered by combining them with each other, other drugs or even food additives, as reported in Nature. For example, vanillin, which gives vanilla its distinctive taste, when paired with spectinomycin, helped it to enter bacterial cells and inhibit their growth."
1801,Environment,New satellite maps show polar ice caps melting at 'unprecedented rate'. Scientists reveal Greenland and Antarctica losing 500 cubic kms of ice annually
1802,Health,"It's been hypothesized that celiac disease has increased because of wheat breeding, which may have created wheat varieties that produce much more gluten than before. So researchers examined 30 varieties of wheat spanning 110 years, and they found no increase the concentration of gluten over time."
1803,Animal Science,A fossilized Rudapithecus pelvis found in Hungary suggests human ancestors were able to stand upright much earlier than anthropologists had realized
1804,Psychology,"‘Magic Mushrooms’ Help Smokers Kick Habit in Small Study: Just two or three experiences with “magic mushrooms” helped a dozen long-term smokers quit, succeeding in a study where numerous other approaches failed."
1805,Computer Science and Engineering,"MIT finger device reads to the blind in real time: Scientists at the Massachusetts Institute of Technology are developing an audio reading device to be worn on the index finger of people whose vision is impaired, giving them affordable and immediate access to printed words."
1806,Physical Science,"A new material has been discovered using computer modelling that can safely and cheaply clean nuclear waste gases, Nature Comm study finds."
1807,Medicine,"Increased cancer rate in US linked to bad environment - Improving the worst environments in the US could prevent 39 in every 100,000 cancer deaths"
1808,Health,"Autism is the fastest-growing developmental disorder in the US, with about one in 68 children born on the spectrum. Taking multivitamins during early pregnancy may be associated with a reduced risk of autism spectrum disorder (ASD) in children compared with mothers who do not take multivitamins."
1809,Health,"A large-cohort study finds that the measles, mumphs, and rubella (MMR) vaccine does not increase the risk for autism, does not trigger autism in susceptible children, and is not associated with clustering of autism cases after vaccination."
1810,Neuroscience,"Playing ‘Tetris’ reduces the strength, frequency and vividness of naturally occurring cravings"
1811,Health,LEDs may cause retinal toxicity at occupational domestic illuminance
1812,Physical Science,Scientists have discovered a group of materials which could pave the way for a new generation of high-efficiency lighting. They developed a new type of material that uses rotatable molecules to emit light faster than has ever been achieved before. It could lead to more efficient displays
1813,Medicine,Polio: Mutated virus breaches vaccine protection
1814,Medicine,Stunner: Researchers retract paper because company complains it’s hurting profits
1815,Astronomy,"1,284 new planets: Kepler mission announces largest collection ever discovered"
1816,Environment,Hurricanes are key to carbon uptake by forests in southeastern United States; the regular water supply from tropical storms is vital for drought mitigation
1817,Neuroscience,"A surprising study found people who had smoked pot as teens performed better on a memory test, based on an fMRI study published in journal NeuroImage."
1818,Psychology,"Cellphone addiction is ‘an increasingly realistic possibility,’ study of college students reveals: Women college students spend an average of 10 hours a day on their cellphones and men college students spend nearly eight, with excessive use posing potential risks for academic performance"
1819,Environment,"Climate change has caused the massive Kaskawulsh Glacier, one of Canada’s largest glaciers, to retreat so much that its meltwater abruptly switched direction, in the first documented case of ""river piracy"" in modern times."
1820,Psychology,The word patterns a person uses when describing a dream can distinguish between schizophrenia and bipolar disorder.
1821,Biology,"New research enables ""tailored"" diet advice – based on our personal gut microbiome - Systems biologists have, for the first time, successfully identified in detail how some of our most common intestinal bacteria interact during metabolism."
1822,Biology,"New study comparing Theropod trackways with bird strides, show that as dinosaurs walked the Earth they moved like modern birds"
1823,Medicine,"A study from the US has found that some groups of people with HIV, especially those treated before their CD4 count falls below 350 cells/mm3, now have life expectancies equal to or even higher than the US general population."
1824,Environment,"No more pause: Warming will be non-stop from now on - Once temperatures start rising again, it looks like they will keep going up without a break for the rest of the century, unless we cut our greenhouse gas emissions."
1825,Health,Procrastination Is Not Great for Your Heart.
1826,Physical Science,"A transformational advance has been made in an alternate lighting source, one that doesn't require a battery or a plug: high-efficient energy transfer between semiconductor quantum rods and luciferase enzymes and when combined correctly, these materials produce bioluminescence"
1827,Psychology,Individuals in remission from bipolar I disorder and major depressive disorder cooperated more in an economic game than individuals with no such history. Results suggest that a history of clinical mood disturbance can generate increases in some prosocial behavior
1828,Medicine,"Scientists switch off molecule that grows new blood vessels for prostate cancer cells, effectively halting the spread of tumors."
1829,Biology,"Researchers discovered that an RNA molecule called TERRA helps to ensure that very short (or broken) telomeres get fixed again. The work, published in the journal Cell, provides new insights into cellular processes that regulate cell senescence and survival in ageing and cancer."
1830,Environment,"In an analysis of more than 1,000 chemicals in fluids used in and created by hydraulic fracturing (fracking), researchers found that many of the substances have been linked to reproductive and developmental health problems, and the majority had undetermined toxicity due to insufficient information."
1831,Environment,Seabird losses from Deepwater Horizon oil spill estimated at hundreds of thousands
1832,Biology,The pineapple genome provides clues into engineering plants with higher water use efficiency
1833,Disease,Drug resistant gonorrhea strain likely to spread
1834,Biology,Oldest example of fossilized fungus contributed to soil formation and started process of rotting on land
1835,Health,Heroin overdose deaths have quadrupled in 5 years among Americans aged 25 to 34.
1836,Computer Science and Engineering,"In a new study, researchers used a customized, low-cost 3D printer to print electronics on a real hand for the first time. Soldiers on the battlefield could use this to print temporary sensors on their bodies to detect chemical or biological agents or solar cells to charge essential electronics."
1837,Social Science,Humanity's forgotten return to Africa revealed in DNA
1838,Biology,"New study adds fascinating new creatures to the Mesozoic Menagerie. These mammals did not lurk in the shadows of dinosaurs. Instead, they glided far overhead, avoiding predatory dinosaurs on the ground — essentially flying squirrels of the Jurassic Period, from an extinct branch of mammals."
1839,Biology,"""Forever chemicals"" study concludes that the less contact food has with food packaging, the lower human expsoure is to PFAS. Authors hope the study spurs ""manufacturers to develop safer food packaging materials."""
1840,Psychology,"Young children's habit of talking to imaginary friends can spur the development of an inner dialogue that they can use to talk themselves through challenging tasks now and later as adults, a study in the November issue of the Journal of Experimental Child Psychology suggests."
1841,Biology,"Old human cells rejuvenated in discovery on ageing - A new way to rejuvenate old cells in the laboratory, making them not only look younger, but start to behave more like young cells, has been discovered. Within hours of treatment the older cells started to divide, and had longer telomeres."
1842,Astronomy,"Astronauts mix cement in space for the first time. By proving you can mix and solidify cement in a microgravity environment, the new research paves the way for building future space colonies on other worlds."
1843,Physical Science,"Study data indicates e-cigarette vapor ""not significant"" in terms of airborne pollutants."
1844,Psychology,"When to make the first move: Experimental research suggests that it is best to move first. In negotiations, people who receive an opening offer become psychologically anchored to that initial proposal which takes the form of a numerical value. All subsequent bargaining builds off that first number"
1845,Environment,"Before we damage the oceans any further, it would be nice to know what actually lives there. Knowlton is part of a pretty clever research solution to this problem — what she calls “underwater condos”"
1846,Health,"Eating peanuts while breastfeeding could protect babies from allergy, study suggests. Researchers found children were five times less likely to develop an allergy if their mothers had eaten nuts before weaning and introduced nuts before one year old."
1847,Psychology,Awakening several times throughout the night is more detrimental to mood than getting the same amount of sleep uninterrupted
1848,Medicine,"Scientists merged stem cell and “organ-on-a-chip” technologies to grow, for the first time, functioning human heart tissue carrying an inherited cardiovascular disease"
1849,Medicine,"A man whose body rejected a face transplant he received seven years ago has been given a second donor face after living nearly two months without one, French medical agencies said on Friday"
1850,Astronomy,SpaceX advances drive for Mars rocket via Raptor power
1851,Neuroscience,"We may crave stability in life, but the brain benefits from volatility, according to a Yale University study on cognition (involving monkeys) that shows how uncertainty boosts learning. Activity in areas of the frontal cortex were dramatically reduced when outcome probabilities were fixed."
1852,Computer Science and Engineering,"Stanford researchers achieve a stable lithium anode, a tremendous advance in battery technology."
1853,Medicine,How evidence-based medicine is failing due to biased trials and selective publication [free pdf]
1854,Neuroscience,"Only 25 Minutes of Mindfulness Meditation Alleviates Stress, According to Carnegie Mellon Researchers: New research from Carnegie Mellon University is the first to show that brief mindfulness meditation practice — 25 minutes for three consecutive days — alleviates psychological stress."
1855,Animal Science,"Scientists have found new species of tarantula in Brazil, named it after John Lennon"
1856,Astronomy,"For the first time, the rotating ""donut"" of dust and gas around a supermassive black hole has been clearly imaged. This allows astronomers to relate the black hole's rotation loss to the magnetic fields around its jets."
1857,Social Science,How hunting with wolves helped humans outsmart the Neanderthals
1858,Environment,Most protected marine areas fail to properly guard aquatic life: study. Research shows 59% of the world's marine parks were 'not ecologically distinguishable from fished sites'
1859,Health,"Maternal antibodies in breast milk provide benefits to the intestinal immune system of the breast-fed infant, which persist into adulthood via lifelong intestinal homeostasis by promoting a healthy gut microbiota and regulation of gene expression in intestinal epithelial cells [Open access article]"
1860,Environment,A team of researchers has found that new global tree growth over the past 35 years has more than offset global tree cover losses. The researchers report that their calculations showed that human activities have directly caused approximately 60 percent of new global tree growth
1861,Astronomy,Hubble captures amazing photo of a supernova at its brightest
1862,Biology,Neanderthals cared for each other and survived into old age – new research
1863,Disease,Geneticists Found the 'Master Tumor Suppressor' That Stops Cancer in Elephants
1864,Social Science,"A new study suggests that Neanderthals across Europe may well have been infected with diseases carried out of Africa by waves of anatomically modern humans, or Homo sapiens. This might have contributed to the demise of Neanderthals."
1865,Psychology,Children with a food allergy had a significantly higher prevalence of childhood anxiety. Food allergies were not associated with symptoms of childhood depression or with symptoms of anxiety or depression among their caregivers. The results are published in the Journal of Pediatrics.
1866,Neuroscience,"Human brain uses standard code for entire spectrum of emotions - “We discovered that fine-grained patterns of neural activity within the orbitofrontal cortex, an area of the brain associated with emotional processing, act as a neural code which captures an individual’s subjective feeling,”"
1867,Psychology,"Most partisans treat politics like sports rivalries, instead of focusing on issues"
1868,Biology,Birds Evolved From Dinosaurs In a 'Supercharged' Evolutionary Surge
1869,Environment,"Biodiversity peaks at mid-altitudes: previously explained as low temperatures at high elevations or human disturbance further down. According to new research, mid-altitudes host the largest number of species because the size and the connectedness of similar habitats are greatest there"
1870,Health,"Vitamin D increases breast cancer patient survival, study shows: Breast cancer patients with high levels of vitamin D in their blood are twice as likely to survive the disease as women with low levels of this nutrient, report researchers"
1871,Astronomy,Astronomers find a rare supernova ‘impostor’ in a nearby galaxy
1872,Psychology,"Does describing a suspect interfere with an eyewitness's ability to later identify a subject? A massive psychological study says ""yes""."
1873,Computer Science and Engineering,"The world's first entirely light-based memory chip to store data permanently has been developed by material scientists. The device, which makes use of materials used in CDs and DVDs, could help dramatically improve the speed of modern computing."
1874,Physical Science,"Scientists find gene that makes plants more carefree under climate stress - The SP1 gene ‘de-stresses’ plants, making them resilient to harsh conditions and furthering the possibility of future crops resistant to drought."
1875,Medicine,The death rate in Massachusetts dropped after it adopted mandatory health care coverage in 2006
1876,Computer Science and Engineering,"‘Smart’ Bandage Emits Phosphorescent Glow for Healing Below: Inspired by wounded warriors, new paint-on, see-through bandage not only protects wounds and severe burns but enables direct measurement of tissue oxygenation"
1877,Biology,Gut bacteria spotted eating brain chemicals for the first time
1878,Medicine,HIV drug used to reverse effects of virus that causes cervical cancer: A commonly-used HIV drug has been shown to kill-off the human papilloma virus (HPV) that leads to cervical cancer in a world-first clinical trial
1879,Animal Science,Researchers find evidence that chimpanzees use arm and mouth expressions to convey distance.
1880,Health,"Six seconds of exercise 'can transform health': Short six-second bursts of vigorous exercise have the potential to transform the health of elderly people, say researchers. ""The team at Abertay University believe it could help avert the 'astronomical' costs of ill health in elderly people"""
1881,Environment,"Divers Found The World's Largest Underwater Cave, And It's Full of Maya Secrets"
1882,Environment,"Coal plant emissions damage infant DNA, a new study shows - A study from Columbia University has found that babies born during a coal plant’s operation in China had shorter telomeres than those born after the plant’s closure."
1883,Biology,"Researchers have identified a way regrow human corneas to restore vision, holding promise for burn patients, victims of chemical injury, and others with damaging eye diseases"
1884,Health,Pediatricians Say School Should Start Later For Teens' Health
1885,Neuroscience,"Common air pollutants may have a detrimental effect on a child’s developing brain. MRIs suggest chemicals produced by dyes, plastics and pesticides may damage the surface of the brain, potentially contributing to ADHD and behavioral problems."
1886,Medicine,"The first trial of a pioneering therapy to retrain the immune system and slow the advance of type 1 diabetes has shown it is safe. The immunotherapy - tested on 27 people in the UK - also showed signs of slowing the disease, but this needs confirming in larger trials."
1887,Environment,"Planting cannabis for commercial production in remote locations is creating forest fragmentation, stream modification, soil erosion and landslides. Without land-use policies to limit its environmental footprint, the impacts of cannabis farming could get worse, according to a new study"
1888,Astronomy,"‘Planet Nine’ Exists Yet Remains A Bit Of A Mystery, New Study Says"
1889,Medicine,Accurate and reproducible invasive breast cancer detection in whole-slide images: A Deep Learning approach for quantifying tumor extent (positive predictive value of 71.62% and a negative predictive value of 96.77%)
1890,Health,"New study finds statistically significant correlation between higher COVID-19 knowledge, more positive attitudes and, most importantly, better adoption and implementation of safety practices.Researchers conclude that improving knowledge among residents is paramount to successfully fighting COVID-19."
1891,Medicine,Dentists of the future will just point a laser on your damaged tooth and it will regrow by itself thanks to stem cells
1892,Biology,"Scientists have discovered the cause of a mass extinction of sea-floor marine organisms 800,000 years ago. They tested various possible causes and were able to discount others such as ocean cooling. They discovered that it was caused by a global change in plankton at the surface of the ocean"
1893,Animal Science,"Bizarre 5-foot-long shipworm found in Philippines' lagoon feeds on hydrogen sulfide gas, unlike wood-munching relatives"
1894,Astronomy,NASA astronaut from historic spacewalk becomes first woman to reach deepest point in ocean
1895,Psychology,Stress undermines empathic abilities in men but increases them in women: Stressed males tend to become more self-centered and less able to distinguish their own emotions and intentions from those of other people. For women the exact opposite is true. This is the main finding of a new study
1896,Medicine,"Scientists develop a contact lens-like, microfluidic device that allows glaucoma patients to self-monitor eye pressure continuously so they don't have to go to doctor's office every week; results are read off by smart phone camera and app"
1897,Physical Science,New study suggests that pockets of liquid water may exist up to 500 miles beneath Earth’s surface. Scientists discovered a rare form of crystalized water known as ice VII in diamond samples recovered in Africa and China.
1898,Social Science,Study links a 4.4-million-year-old hominid called Ardipithecus ramidus to human lineage
1899,Psychology,"Individuals who blame karma for their poor health have more pain and worse physical and mental health, according to a new study"
