,flair,title
2472,Astronomy,Complex life may be possible in only 10% of all galaxies
2473,Social Science,"In a study of nearly 1,300 returning Veterans reporting reintegration problems, those who completed online expressive-writing sessions showed more improvements than peers who had not written at all or who had engaged only in factual writing"
2474,Social Science,Skeleton of Alexander the Great's Father (King Philip II) Found
2475,Astronomy,"Researchers have discovered that the first stars appeared 550 million years after the Big Bang, approximately 100 million years later than previously thought."
2476,Disease,"Studying human tumors in mice may end up being misleading. Tumors evolve to adapt to their new environment: a mouse. In other words, a drug that seems ineffective when tested in mice might actually work in the human patient in which the cells originated, finds new study in Nature Genetics."
2477,Animal Science,"New research shows that the koala is developing genomic immunity to koala retrovirus, a disease that makes the animal susceptible to chlamydia, leukemia, and lymphoma. This immunity is something scientists knew about in theory but had never observed in-progress."
2478,Animal Science,Human behaviour can trigger large carnivore attacks in developed countries
2479,Physical Science,"Experiments increase potential solar cell output, with scientists demonstrating a method for getting high-energy photons striking silicon to kick out two electrons instead of one, that could produce an increase in the power produced by solar cells, from a theoretical maximum of 29.1% to about 35%."
2480,Disease,First case of MERS confirmed in US by CDC
2481,Social Science,"The world's population is growing faster than we thought. According to a new report by the Population Reference Bureau (PRB), the world's population could swell to 9.9 billion by 2050."
2482,Social Science,"900-Year-Old Coded Viking Message Carved on Wood Fragment Finally Solved, It Says “Kiss Me”"
2483,Astronomy,"Gliese 1132b: Astronomers find a super-Earth that may have a watery atmosphere, just 39 light-years away"
2484,Astronomy,NASA plans a robotic mission to search for life on Europa.
2485,Neuroscience,Psychopathic Violent Offenders’ Brains Can’t Understand Punishment
2486,Social Science,Study finds that doctors receiving payments from the drug industry were more likely to prescribe brand-name gabapentinoids than the generic alternative.
2487,Physical Science,"Colossal Antarctic ice-shelf collapse followed last ice age; 100,000 square miles of Ross Ice Shelf disappeared in 1,500 years"
2488,Astronomy,Scientist discovered giant black hole trio spiraling into each other
2489,Disease,"To date, the Ebola epidemic in West Africa has sickened 13,567 people and killed 4,591. Now, a new study has isolated the key strategies that must be implemented if the virus' spread is to be contained."
2490,Animal Science,"Birds do not habituate to traffic noise. Noise pollution is one of the leading environmental health risks in humans. In zebra finches, noise affects their health and the growth of their offspring."
2491,Animal Science,"Study finds fish preserve DNA 'memories' far better than humans - University of Otago researchers report that memory in the form of 'DNA methylation' is preserved between generations of fish, in contrast to humans where this is almost entirely erased."
2492,Neuroscience,The brain’s super-sensitivity to curbs
2493,Disease,DNA in saliva reveals the presence of head and neck cancer.
2494,Environment,Ancient Diseases Reviving Due to Melting Permafrost
2495,Physical Science,"Nuclear fusion on brink of being realised, say MIT scientists"
2496,Physical Science,"Prototype early-warning system works again for recent 5.1 earthquake: seismologists in Pasadena had about a four-second heads-up. Fully funded system could give LA 40-50 second warning ""big one"" is coming so firefighters to open up garage doors, high-speed trains to slow down to avoid derailment."
2497,Social Science,3000-year-old toolkit suggests skilled warriors crossed Europe to fight an epic battle
2498,Environment,Huge coral reef discovered at Amazon river mouth
2499,Social Science,"50,000 year old Neanderthal dental plaque samples reveal what they ate, what their health was like, and how the environment impacted their behavior. One sample revealed that a subject ate a plant containing salicylic acid(the active ingredient of aspirin) and a natural antibiotic mold(Penicillium)"
2500,Neuroscience,Memory loss associated with Alzheimer's disease reversed for the first time.
2501,Environment,"Three trillion trees live on Earth, but there would be twice as many without humans, study in Nature shows"
2502,Social Science,"Paper finds that elite scientists impede progress in their field until they die: ""Overall, these results suggest that outsiders are reluctant to challenge leadership within a field when the star is alive and that a number of barriers may constrain entry even after she is gone"" (pdf)"
2503,Animal Science,Ravens have social abilities previously only seen in humans.
2504,Environment,"The British don't see cold weather as evidence against climate change, according to new polling | The new paper suggests that after a particularly cold snap, three times as many people in the UK see the cold weather as pointing towards the reality of climate change, rather than a reason to doubt it."
2505,Animal Science,"First octopus genome is fully sequenced. An international team analyzed the California two-spot octopus genome, revealing the features that may have given rise to its complex nervous system and adaptive camouflage."
2506,Physical Science,Physicists have studied the above-average lubricity of graphene anchoring two-dimensional strips of carbon atoms—so-called graphene nanoribbons—to a sharp tip and dragged them across a gold surface. Researchers are hoping to fathom out the causes of superlubricity.
2507,Computer Science and Engineering,"New computational model, built on an artificial intelligence (AI) platform, performs in the 75th percentile for American adults on standard intelligence test, making it better than average, finds Northwestern University researchers."
2508,Animal Science,Crows match children under age 7 in a myriad of reasoning tests intended to test comprehension of causality
2509,Physical Science,"A new study suggests that volcanic eruptions did not lead to the extinction of the dinosaurs, and also demonstrates that Earth's oceans are capable of absorbing large amounts of carbon dioxide—provided it is released gradually over an extremely long time."
2510,Physical Science,"Scientists have built a 3D printer to make graphene aerogel, which is one of the world's least dense materials"
2511,Astronomy,Today a team of American astronomers have solved a 50-year-old mystery: why the universe's brightest galaxies are so absurdly luminous. Impartial scientists have said the new paper “offer[s] unprecedented clarity in understanding the origins of such deep-space monsters.”
2512,Neuroscience,Scientists Just Tested Psychedelic Drugs on Lab-Grown 'Minibrains' - They found that a single 24-hour treatment with 5-MeO-DMT downregulated pathways that are associated with inflammation and substance-use disorders.
2513,Neuroscience,A team of neuroscientists based in Singapore has documented what’s going on in the brain when the battle to stay awake is momentarily lost.
2514,Physical Science,Juno mission: Nasa spacecraft successfully enters Jupiter's orbit – watch live | Science
2515,Computer Science and Engineering,"Using Angular Momentum, Swiss Engineering School makes a cube that balances itself in any situation. Few other cool tricks as well."
2516,Astronomy,"NASA's Hubble Space Telescope has detected a stratosphere, one of the primary layers of Earth's atmosphere, on a massive and blazing-hot exoplanet known as WASP-33b"
2517,Environment,"New research suggests California's weather is defying the odds. Meteorologists expected precipitation debts accrued during California's historic drought to last decades, but a new analysis suggests the debts could be erased this year."
2518,Neuroscience,Psychologists developed a method to understand the effects of stroke on brain
2519,Environment,"Climate change is messing with leaves, and leaves are messing back. Between 1981 and 2012, the timing of leaf emergence (“leaf-on”) and death (“leaf-off) apparently “changed severely” on 54 percent of the planet’s land surface. Overall, 95 percent of land surface experienced some change."
2520,Environment,Climatologist Who Predicted California Drought 10 Years Ago Says It May Soon Be ‘Even More Dire’
2521,Animal Science,Fat fish illuminate human obesity: Binge-eating cavefish share mutated gene with some obese people
2522,Environment,"Bats provide a service worth an estimated US $1bn (£649m) globally by controlling pests on corn crops, a study has suggested."
2523,Disease,Chinese scientists found a way to starve cancer cells
2524,Computer Science and Engineering,"Researchers discover faster, more efficient gait for six-legged robots walking on flat ground. Bio-inspired gaits used by real insects are less efficient for robots. Results provide novel approaches for roboticists and new information to biologists."
2525,Social Science,"Travel studies show that, on average, humans now travel farther than ever before—but not more often"
2526,Neuroscience,"The brain has a “noise cancelling” circuit in the form of a cortical filter that learns to suppress the acoustic consequences of movement, so that we can dynamically filter out the sounds of our own movement such as our own footsteps, as shown in a new mouse study."
2527,Environment,"Solar is a better investment than S&amp;P 500 stocks in 46 of 50 largest US cities, study says"
2528,Social Science,"Scientist report on how West African Green monkeys respond to a new threat (drones) by associating a new words/vocalization for drones that sounds remarkably like the vocalizations that Vervet monkeys make for ""eagle"" - they suggest an evolutionary vocalization structure for the similar vocalization"
2529,Disease,Mississippi and West Virginia have the highest rates of vaccination in the US
2530,Social Science,Old World metals were traded on Alaska coast several hundred years before contact with Europeans
2531,Astronomy,New Big Bang evidence also hints that we may exist in a multiverse
2532,Disease,Finding out what causes the genetic mutation within a cell that leads to cancer has been the holy grail of medical science for decades. Researchers believe they may have found one of the reasons why these genes mutate and it all has to do with how stem cells talk to each other.
2533,Social Science,California's prison population reduction did not lead to increase in aggregate crime
2534,Physical Science,"Estimates of the magnitudes of major marine mass extinctions in earth history, the great terminal Permian crisis eliminated only about 81% of marine species, not the frequently quoted 90–96%. Life did not almost disappear at the end of the Permian, as has often been asserted."
2535,Physical Science,"Chemists create a new type of photovoltaic out of cesium-doped perovskite that is transparent at room temperature but turns dark at high temperatures, setting the stage for smart windows that also generate electricity."
2536,Animal Science,"Chlamydia has hit wild koalas hard, with some wild populations seeing a 100% infection rate. Scientists may now have discovered how antibiotics can better help Australian marsupials infected with the sexually transmitted disease."
2537,Animal Science,"Knut the polar bear's cause of death revealed - They analysed samples of Knut’s cerebrospinal fluid and found high levels of an antibody known to attack a glutamate receptor in the brain. In humans, this is a sign of a disease called autoimmune encephalitis, the first ever reported in a non-human."
2538,Environment,"Humans tossed 8 million metric tons of plastic into the ocean in 2010, according to a new study. That’s about five shopping bags full of plastic for every foot of coastline in the world."
2539,Neuroscience,"“Eating addiction”, rather than “food addiction”, better captures addictive-like eating behavior"
2540,Environment,"It's been called the “hiatus,"" “pause,” or “slowdown” and has been a favored meme of climate skeptics for years, but two new studies show the slowdown in global warming has natural causes and we could be in real trouble when it comes to an end."
2541,Disease,Implant 'traps' spreading cancer cells
2542,Neuroscience,Researchers have developed biocompatible brain implants that can monitor brain injury before completely dissolving.
2543,Animal Science,New luminous creatures have been found in the Red Sea
2544,Neuroscience,"New study shows that salts in the brain act as a wake up ""switch"""
2545,Animal Science,new study finds that a commonly used insecticide kills much of the sperm created by male drone honey bees
2546,Physical Science,"New Theory Suggests Black Holes Are ""Back Doors"" to The Universe"
2547,Physical Science,DNA cube programmed for an exclusive reveal: Scientists in Canada have made DNA cubes that are programmed to unzip and reveal molecules locked inside them in response to a carefully chosen trigger. The cubes release the drug cargo they might be carrying only in diseased cells and not normal cells.
2548,Physical Science,CERN Announces Nearly All High-Energy Physics Articles Will Switch To Open Access -- The Largest-Ever OA Initiative
2549,Environment,Stanford scientists unveil a 50 state plan to put the us on renewable energy.
2550,Environment,"Four Years After Deepwater Horizon Spill, Oil Continues to Wash Up on Shore - It reaches land in the form of oil-soaked sand patties"
2551,Physical Science,"Researchers have demonstrated the first laser based on an unconventional wave physics phenomenon called bound states in the continuum. The technology could revolutionize the development of surface lasers, making them more compact and energy-efficient for communications and computing applications"
2552,Environment,"EPA keeps US scientists from presenting climate report, agency accused of censorship"
2553,Animal Science,"A new study debunks cheetah myths. It was believed that chasing prey leaves cheetahs overheated and too exhausted to try again if it fails, or even to protect its meal if it succeeds, but that's not true."
2554,Disease,More evidence that autism is linked to gut bacteria
2555,Social Science,"Kids learn moral lessons more effectively from stories with humans than human-like animals, new study shows"
2556,Neuroscience,Heavy marijuana use shrinks your brain but compensates by making more connections
2557,Social Science,"Students Have 'Dismaying' Inability To Tell Fake News From Real, Study Finds"
2558,Social Science,"Archaeologists find chemical traces of pine resin on 10 Neolithic stone tools, suggesting that Neanderthals were hafting their tools and securing them in place onto wooden handles with resin between 55,000 and 40,000 years ago—long before Homo sapiens set foot in Europe."
2559,Physical Science,Hydrogen turned into metal in stunning act of alchemy that could revolutionise technology and spaceflight
2560,Environment,"Fracking Can Contaminate Drinking Water: It took nearly a decade, but former EPA scientist Dominic DiGiulio has proved that fracking has polluted groundwater in Wyoming"
2561,Physical Science,MIT professor proposes a thermodynamic explanation for the origins of life.
2562,Computer Science and Engineering,Engineer scientists design a thin fabric-like camouflage material with millimeter resolution: like octopus skin it detects and matches patterns autonomously with quick 1 to 2 second response times
2563,Physical Science,"World's First Magnetic Hose Created: An international team of scientists has developed a material which guides and transports a magnetic field from one location to the other, similar to how an optical fibre transports light or a hose transports water."
2564,Social Science,"DNA from an ancient woman’s remains have established a genetic link between modern-day Indians and the Indus Valley Civilization’s people. The work helps illuminate where these people, who created one of the cradles of civilization, came from. Just as importantly, it also reveals where they went."
2565,Neuroscience,"Fear is controlled by a particular gene which can be extinguished through modification of DNA, or by controlling a novel mechanism of gene regulation associated with fear extinction."
2566,Physical Science,‘Date Rape’ Drug Is Now Detectable By a Fluorescent Sensor
2567,Physical Science,St. Helena anomaly in Earth's magnetic field may be an anomaly that has repeatedly occurred over 11 million years.
2568,Physical Science,A 30-year alarm on the reality of climate change. Three decades have passed since then-NASA scientist James Hansen testified before the Senate Energy committee and alerted the country to the arrival of global warming.
2569,Social Science,Study shows that spending less on wedding and engagement ring reduces your chance of divorce
2570,Environment,Melting Permafrost Linked To Impending Environmental Disaster — Study
2571,Social Science,"Having more tree cover in high-poverty urban schools predicted better math performance in a new study based on 318 public schools in Chicago, a statistically significant finding even after controlling for poverty and minority status."
2572,Disease,"Cannabinoids increase lung cancer cell lysis by lymphokine-activated killer cells via upregulation of ICAM-1. ""These findings provide proof for a novel antitumorigenic mechanism of cannabinoids."""
2573,Physical Science,New particle called quantum droplet discovered
2574,Astronomy,Rosetta Probe Directly Discovers Organic Molecules on Comet
2575,Social Science,Rise in marijuana in U.S. use not as high as previously reported
2576,Animal Science,"Males animals, especially birds, often employ bright colors and other anatomical eccentricities to attract mates. It was thought for females, camouflage was more important, or that ornamentation diminished fertility. New research suggests females employ a drab appearance to limit sexual harassment."
2577,Neuroscience,"Researchers discover the potential mechanism for regrowing damaged nerve fibres, in breakthrough study. If translated to humans, it could mean that spinal cord injuries could finally become reparable."
2578,Physical Science,"Previous Evidence of Water on Mars Now Identified as Grainflows - Dark features previously proposed as evidence for significant liquid water flowing on Mars have now been identified as granular flows, where sand and dust move rather than liquid water, according to new article in Nature Geoscience."
2579,Neuroscience,"Members of a tribe with a tradition of eating brains developed a resistance to brain disease, including kuru, mad cow disease and some cases of dementia. Researchers say it's a huge step toward understanding these diseases and other degenerative brain problems, including Alzheimer’s and Parkinson’s."
2580,Social Science,Major breakthrough in reading the ancient Herculaneum scrolls
2581,Animal Science,Female shark learns to reproduce without males after years alone in tank
2582,Animal Science,Heterosexual male rats develop same-sex sexual preference when treated with oxytocin and dopamine while cohabiting with another male rat
2583,Neuroscience,Transplanted embryonic nerve cells can functionally integrate into damaged neural networks
2584,Environment,Warmer temperatures increase mortality from sea star wasting disease
2585,Social Science,"Researchers taste and analyze 170-year-old bottle of champagne recovered from shipwreck in the Baltic Sea. Expert tasters have described the champagne as cheesy, metallic, grilled, spicy, smoky, and leathery, with notes of animal, wet hair, truffles, honey and fruit."
2586,Animal Science,High-speed cameras capture super speedy tap dancing cordon-bleu songbirds' courtship display
2587,Environment,Big Trees First to Die in Severe Droughts
2588,Disease,Acetaminophen exposure in pregnancy increases the risk of ADHD-like behaviours. Our study also supports earlier claims that findings are specific to acetaminophen.
2589,Computer Science and Engineering,"Plasma technology could hold the key to creating a sustainable oxygen supply on Mars, a new study has found. It suggests that Mars, with its 96% carbon dioxide atmosphere, has nearly ideal conditions for creating oxygen from CO2 through a process known as decomposition."
2590,Computer Science and Engineering,"Harvard researchers design a foldable 3D material that can be continuously reprogrammed to change size, volume and shape: from a house that fits in a backpack to a popup relief dome."
2591,Astronomy,Scientists discover terrestrial exoplanet orbiting an M dwarf only 39 light years away.
2592,Social Science,"Scientists working in East Africa say they've unearthed the oldest stone tools ever found. They were apparently made 500,000 years before the human lineage evolved."
2593,Social Science,Paper: Homeownership a ‘dream deferred’ for millennial generation
2594,Animal Science,"New study finds that the population decline of monarch butterflies often blamed on a lack of milkweed, herbicides and genetically modified crops, is better explained by sparse autumnal nectar sources, weather and habitat fragmentation."
2595,Social Science,"Adolf Hitler definitely died in 1945 in Berlin, from taking cyanide and a bullet, according to French researchers who were given access to fragments of the dictator's teeth held in Moscow."
2596,Disease,"Higher levels of vitamin D3 in pregnancy associated with lower risk of developing ADHD symptoms in childhood, a prospective study found"
2597,Computer Science and Engineering,Researchers Discover a Pattern to the Random Distribution of Prime Numbers and to predict them
2598,Environment,"NOAA: 2014 is shaping up as hottest year on record. ""So far this year, record-breaking warmth has been observed in at least every continent and major ocean basin of our planet. This is something we cannot ignore."""
2599,Neuroscience,A drug which has already been in use for decades to treat liver disease could be an effective treatment to slow down progression of Parkinson's disease
2600,Astronomy,A Star Just Exploded 'Next Door' And It's A Huge Deal
2601,Neuroscience,Scientists have found that memories may be passed down through generations in our DNA
2602,Environment,A study has found that British adolescents raised in major cities in England and Wales were over 40 per cent more likely to report psychotic experiences (e.g. hearing voices and feeling extremely paranoid) than their rural counterparts.
2603,Neuroscience,Neuroimaging study: Narcissists feel distressed rather than gratified when viewing themselves
2604,Computer Science and Engineering,UC Irvine student accidentally invents a battery that lasts forever
2605,Social Science,New DNA evidence uncovered by researchers at Uppsala University and Stockholm University shows that there were in fact female Viking warriors
2606,Astronomy,Atoms can be in two places at the same time
2607,Astronomy,"Three nearly Earth-size planets found, one with possibility of surface temperatures conducive to liquid water &amp; life"
2608,Environment,"Conservatives are substantially more likely to believe that climate change is happening, human-caused and something to worry about if they are surrounded by close friends and family members who overwhelmingly accept the scientific consensus."
2609,Environment,bats in the US eat so many insects that they save farmers an estimated $22.9 billion every year on pesticides.
2610,Neuroscience,Relationship between brain stem volume and aggression in children diagnosed with autism spectrum disorder
2611,Disease,"Caitlin Miron, a PhD student, discovered a way to prevent the spread of cancer cells, received the Mitacs Award for Outstanding Innovation - PhD in Ottawa."
2612,Animal Science,"A dairy bull made hornless by gene editing has passed the trait on to his offspring. The method could replace physical dehorning of dairy calves, routinely done for animal safety."
2613,Disease,"New research finds that after full implementation of the Affordable Care Act (ACA), the percent of uninsured decreased substantially in Medicaid expansion states among the most vulnerable patients: low-income nonelderly adults with newly diagnosed cancer - in Journal of Clinical Oncology."
2614,Environment,Farming Now Worse For Climate Than Deforestation. Recent climate-protecting gains in forests are being nearly canceled out by efforts to satisfy the world’s growing appetite — particularly its appetite for meat.
2615,Astronomy,Scientists have discovered a massive extrasolar planet located outside our solar system with a mass that is about 25 times the mass of Jupiter or approximately 8000 times the mass of Earth.
2616,Environment,"China has reached a tipping point where home-generated solar is cheaper than electricity generated from the national grid. The research, conducted by researchers in both Sweden and China and published in the journal Nature Energy, mark an historic moment in the drive to ditch fossil fuels."
2617,Disease,Tobacco plant has key to fighting cancer: Scientists at the La Trobe Institute for Molecular Science have identified that a molecule occurring in the flower of the plant that fights off fungi and bacteria also has the ability to identify and destroy cancer.
