,flair,title
0,Health,Young Blood May Hold Key to Reversing Aging
1,Computer Science and Engineering,"Mathematical model describes the physical principles that guide behavior in a peloton, the groups of cyclists that form during mass-start races like the Tour de France. Biologists say it may also apply to migrating birds and shoaling fish."
2,Medicine,How one scientist is growing miniature brains in her lab
3,Astronomy,"A Second 'Big Bang' Could End Our Universe in an Instant, Thanks to The Higgs Boson. Researchers have found that destabilization of the Higgs boson could lead to an explosion of energy that would consume everything in the known universe and upend the laws of physics and chemistry."
4,Environment,"It's Possible To Cut Cropland Use in Half and Produce the Same Amount of Food, Says New Study"
5,Astronomy,"Nasa wants you to become a Disk Detective &amp; spot planet formation - Over 500,000 unidentified objects in the sky to choose from."
6,Medicine,Cancer drug combination 'shrinks 60% of melanomas' - BBC News
7,Astronomy,"Simulation finds that Saturn's moon Titan could support life without liquid water on its surface, meaning the planet could hold the first example of life outside the sun's habitable zone"
8,Health,"Strength exercise may be just as vital as aerobic. Push ups and sit ups could add years to your life according to a new study of over 80,000 adults. People who did strength-based exercise had a 23% reduction in risk of premature death by any means, and a 31% reduction in cancer-related death."
9,Psychology,Does a junk food diet make you lazy? A new UCLA psychology study provides evidence that being overweight makes people tired and sedentary — not the other way around.
10,Medicine,"In a First, Gene Therapy Halts a Fatal Brain Disease"
11,Physical Science,Ozone hole three times the size of Greenland opens over the North Pole
12,Physical Science,New U.S. time standard: Atomic clock will neither gain nor lose one second in about 300 million years
13,Physical Science,Extremely Rare Type of Iron Oxide Found in Ancient Chinese Pottery
14,Physical Science,Physicists have measured the half-life of iron-60 with an accuracy sufficient to support its use as a chronometer for cosmic processes.
15,Medicine,Mice with hereditary deafness hear again thanks to gene therapy
16,Psychology,"Simply telling people that their opinions are based on morality will make them stronger and more resistant to counterarguments, a new study suggests."
17,Health,Gluten-free diets adopted by rising number of consumers enhance risk of Type 2 diabetes: Harvard study
18,Physical Science,"According to new computer simulations, (frictionless) superfluids can act as if they have some form of viscosity when they are magnetized, flowing together to form weird shapes"
19,Environment,Research downplaying impending global warming is overturned
20,Biology,Blood test may give early warning of skin cancer relapse
21,Astronomy,"For the first time, evidence of water has been found in a stony type of asteroid once thought to be bone-dry. Grains of dust from the asteroid Itokawa actually contain a surprising amount of water, two cosmochemists from Arizona State University in Tempe report May 1 in Science Advances."
22,Medicine,Modifying the gut microbiota may offer an alternative approach for the treatment of polycystic ovary syndrome
23,Environment,Berkeley Lab scientists identify new driver behind Arctic warming
24,Health,"A new study found that people who walked for 90 minutes in a natural area, as opposed to participants who walked in a high-traffic urban setting, showed decreased activity in a region of the brain associated with a key factor in depression."
25,Health,Study finds no link between insomnia and cholesterol levels
26,Medicine,"“After three months of medical marijuana treatment, patients actually performed better, in terms of their ability to perform certain cognitive tasks, specifically those mediated by the frontal cortex.” - New pilot study."
27,Biology,"Another piece to the puzzle in naked mole rats’ long, cancer-free life: Naked mole rats do experience cellular senescence, yet continue to live long, healthy lives. Their senescent cells display unique features that may contribute to cancer resistance and longevity, as reported in PNAS this week."
28,Biology,[Press Release] Newly Discovered Immune Cell Linked to Type 1 Diabetes
29,Health,Comprehensive Study Suggests Most Heterosexual Couples Get Better Sleep When Together
30,Biology,"Researchers believe that working with the fungi that inhabit the roots of plants rather than against them, as has often been the case in conventional agriculture, will help the world grow more food with less environmental impact"
31,Health,"Drinking 3 to 5 Cups of Coffee a Day lowers risk of having calcium deposits in the coronary arteries (which is an indicator of heart disease), new study shows."
32,Environment,"Gulf Stream is slowing down faster than ever, scientists say ""outside of any natural variation"""
33,Astronomy,Most-ever detailed 3D map of the Milky Way galaxy released in Science today
34,Psychology,"Why loneliness may be the biggest threat to survival and longevity. Insufficient social stimulation affects reasoning and memory performances, hormone homeostasis, brain grey/white-matter, connectivity and function, as well as resilience to physical and mental disease"
35,Medicine,"Totality of trials data confirm Tamiflu reduces length of symptoms, complications, and hospital admissions from influenza"
36,Biology,Planarian regeneration model discovered by artificial intelligence
37,Psychology,A meta-analysis of 20 controlled studies finds that action video games like Call of Duty and Unreal Tournament moderately benefit cognitive function.
38,Neuroscience,New immunotherapy combo effectively treats advanced brain cancer in pre-clinical models
39,Social Science,"Being with friends makes life less stressful by regulating the way our bodies manage stress-indicating hormones, according to a new chimp study"
40,Neuroscience,Human brains naturally shrink with age. But a study that followed 401 people in their 70s found that the brains of those who adhered more closely to a Mediterranean-style diet shrank significantly less over a period of three years.
41,Psychology,"Contrary to popular belief, busy city centres beat suburban living when it comes to human wellbeing, as socialising and walking make for happier, healthier people, according to a new report."
42,Social Science,Undisclosed Conflicts of Interests among Biomedical Textbook Authors. Authors received millions of dollars from biopharmaceutical companies. None of this was disclosed to readers.
43,Psychology,Study reveals significant rise in psychological stress in people who engage in political activism using social networking sites.
44,Health,"8 Coffees a Day Means a Longer Life Than No Coffee, According to a 10-Year Study"
45,Medicine,"Researchers engineer insulin-producing cells activated by light using optogenetics, and transplanted these engineered cells under the skin of diabetic mice, successfully showing that glucose levels can be controlled in a mouse model of diabetes without pharmacological intervention."
46,Astronomy,"New research suggests that the sugar ribose - the ""R"" in RNA - is probably found in comets and asteroids that zip through the solar system and may be more abundant throughout the universe than was previously thought."
47,Social Science,"Analysis of more than 2,000 college STEM classes has imparted a lesson that might resonate with many students who sat through them: Enough with the lectures, already. Prior research has identified lecturing as among the styles least effective at teaching and engaging students."
48,Physical Science,1% of people cause half of global aviation emissions study finds
49,Animal Science,"Aedes japonicus mosquitoes found in western Canada: Canadian entomologists have reported the first appearance of Aedes japonicus - an invasive, disease-carrying mosquito - in western Canada"
50,Health,"Individuals addicted to cocaine may have difficulty in controlling their addiction because of a previously-unknown ‘back door’ into the brain, circumventing their self-control, suggests a new study led by the University of Cambridge."
51,Biology,"Long-held theory on human gestation refuted: Mother’s metabolism, not birth canal size, limits gestation"
52,Biology,"Sequencing 50,000+ human exomes, and pairing the data with electronic health records reveals that participants had on average 21 alleles with loss of function mutations, and ~3.5% of participants had mutations that were likely to be clinically relevant."
53,Neuroscience,"Psychedelics seem to alter social cognition by modifying facial emotion recognition, suggests a new study, that found that drugs like LSD reduce recognition of negative facial emotions by altering activity in the amygdala, a brain region known to be important for responses to threatening situations."
54,Psychology,"Recalling Positive Events at Work Makes Employees Feel Happier, Move More, but Interact Less: A 6-Week Randomized Controlled Intervention at a Japanese Workplace [PDF]"
55,Social Science,A new research suggests that a child's cognitive and behavioral growth is benefited by parents who foster a sense of independence in their children while remaining emotionally available.
56,Psychology,"Emphasizing mastery of content over grades in college classes reduces cheating, but only if students like the class."
57,Environment,Scientists link Europe heat wave to human-caused global warming
58,Health,Opportunities and Implications of Pasture-Based Lamb Fattening to Enhance the Long-Chain Fatty Acid Composition in Meat
59,Physical Science,How the 18th-century steam engine helped physicists make a quantum breakthrough
60,Health,"Cellphone radiation poses no real harm to humans, new research says - ""The study specifically used 2G and 3G frequencies—not frequencies used on more advanced 4G or 5G networks. Researchers exposed the rodents’ entire bodies to the radiowaves for more than nine hours per day, for up to two years."""
61,Health,Human-Neanderthal gene variance is involved in autism
62,Health,"High Intensity Interval Training (HIIT) improves resting blood pressure, metabolic (MET) capacity and heart rate reserve without compromising cardiac function in sedentary aging population"
63,Computer Science and Engineering,"Self-healing metal oxides could protect against corrosion. Researchers have found that a solid oxide protective coating for metals can, when applied in sufficiently thin layers, deform as if it were a liquid, filling any cracks and gaps as they form."
64,Neuroscience,Researchers develop device that can 'hear' your internal voice
65,Social Science,New findings in Germany challenge view that bipedal walking evolved in Africa
66,Psychology,"People who make plans to avoid or handle temptations may be more likely to achieve goals, such as academic and weight loss goals. Proactively planning to manage temptations may be more effective than simply responding to temptation when it arises."
67,Environment,"Banned Chemical Still Contaminating San Francisco Seals: A manmade chemical, pulled from production 12 years ago, is still turning up at high levels in seals"
68,Animal Science,"Sharks can be 'social or solitary': The most feared predators in the sea have individual personalities that affect how readily they socialise, according to a study by UK scientists."
69,Environment,"A new study shows Lone Star State companies are the biggest offenders in the nation when it comes to releasing pollution into our waterways. In 938 instances, Texas companies released pollution that exceeded the levels permitted by federal clean water laws"
70,Disease,"A new study which forecasts population scenarios for 195 countries and territories from 2017 to 2100, suggests that falling fertility rates will mean most countries could have shrinking populations by the end of the century-- many countries will see their populations dropping by more than 50%"
71,Physical Science,'Make-a-wish' coins changing the colour of Yellowstone's thermal springs
72,Health,"Certain gut bacteria linked to type 2 diabetes, reveal Russian scientists"
73,Astronomy,Hubble Space Telescope Focuses on Lonely Dwarf Galaxy
74,Neuroscience,"An Alzheimer’s drug, verubecestat, has been shown to effectively “switched off” the production of toxic amyloid proteins that lead to the sticky plaques seen in the brains of Alzheimer’s patients by halting the steady production of amyloid-beta proteins through blocking a brain enzyme called BACE1."
75,Biology,Japanese scientists turn blood cells into stem cells by dipping them in acid
76,Medicine,Single dose of inhaled vaccine that’s under development provides long-term protection for non-human primates against the Ebola virus
77,Environment,"Study suggests chemical used in BP oil spill cleanup capable of injuring people and wildlife: Scientists found that the dispersant can seriously damage epithelial cells, such as those in the lungs of humans or the gills of marine animals."
78,Health,Dengue Virus is Rapidly Evolving
79,Psychology,Parents have more conflicts with their in-laws than do childless couples. Daughters-in-law were more likely to report conflicts when their mother-in-law provided more grandchild care.
80,Astronomy,NASA photo captures strange bright light coming out of Mars
81,Health,"When you take acetaminophen to reduce your pain, you may also be decreasing your empathy for both the physical and social aches that other people experience, a new study suggests."
82,Astronomy,LIGO Detects Gravitational Waves for Third Time
83,Biology,"Daylight Saving Time has long-term effects on health. Over time, DST eliminates bright morning light that critically synchronizes biologic clocks, which can be associated with increased risk of heart attack and ischemic stroke, as well as other negative effects of partial sleep deprivation."
84,Biology,Scientists revive giant Neanderthal virus entombed in ice
85,Animal Science,Scientists discover 99-million-year-old lizards preserved in amber
86,Social Science,Study of U2 could help music fans find what they're looking for
87,Disease,A 'one-two punch' to wipe out cancerous ovarian cells. Researchers have developed a two-step combination therapy to destroy cancer cells.
88,Astronomy,Astronomers Have Found a Record-Breaking Star That's Nearly as Old as The Universe
89,Neuroscience,"Infants are born with Bradycardic Response, which allows them to slow heart rate and hold their breath underwater for more than 40 seconds. This phenomenon inexplicably disappears at 6 months of age."
90,Environment,"Almost one billion tonnes of plastic will be dumped on land and in the oceans over the period from 2016 to 2040 unless the world acts, say a team of 17 global experts who have developed a computer model to track the stocks and flows of plastic around the world."
91,Astronomy,"IC 1101, the largest galaxy in the observable universe, is about 1.07 billion light years from Earth."
92,Health,Study supports cancer link with height
93,Biology,"Bacteria can produce a high-protein sustainable food source, in the form of recombinant protein, in competition with cows, finds Danish researchers using the food protein, Bovine Alpha Lactalbumin, as a case study."
94,Biology,Conscious plants: new study shows plants react to anesthetics in a similar fashion to animals
95,Health,Industry uses non-profit organisation to campaign against public health policies - New study shows how a non-profit research organisation has been deployed by major food and beverage corporations to push industry-favourable positions to policy makers under the guise of neutral scientific endeavour.
96,Health,"Contrary to popular belief, consuming red meat and white meat such as poultry, have equal effects on blood cholesterol levels, according to a study published today in the American Journal of Clinical Nutrition."
97,Computer Science and Engineering,"Fusion reactors could become an economically viable means of generating electricity within a few decades, and policy makers should start planning to build them as a replacement for conventional nuclear power stations, according to new research."
98,Astronomy,A team of scientists have devised a controversial theory which says the expansion of the universe is driven by quantum fluctuations —not dark energy
99,Environment,"Rapid Arctic ice loss linked to extreme weather changes in Europe and US. Arctic warming appears to be the prime reason behind fluctuations in the polar jet stream that is causing unusual weather, study says"
100,Biology,Dinosaurs may have danced like birds to woo mates
101,Medicine,"After Surgery, Black Children have 3.5 times higher chance of dying within 30 days of surgery: A study of nearly 200 U.S. medical centers found that even apparently healthy kids suffer racial disparities in complications associated with surgery"
102,Disease,"Cancer cases are expected to surge 57% worldwide in the next 20 years, an imminent ""human disaster"" that will require a renewed focus on prevention to combat, according to the World Health Organization"
103,Psychology,Young adults with autism show improved social function following skills program
104,Neuroscience,Brain's ability to dispose of key Alzheimer's protein drops dramatically with age
105,Physical Science,"A quark-gluon plasma spins ten billion trillion times faster than the most powerful tornado, setting new record for ""vorticity."""
106,Physical Science,"Seismic evidence for significant melt beneath the Long Valley Caldera, California"
107,Social Science,"Interpretation of climate data is vulnerable to political and psychological biases, but when people were asked to predict arctic sea ice levels, they more accurately forecasted when political symbology was removed from the questions"
108,Social Science,"New finds from Mexico suggest people were living in the Americas 33,000 years ago, twice the widely accepted age for the earliest settlement."
109,Neuroscience,"Experimental cancer drug FRAX486 'reverses schizophrenia in mice': An experimental cancer drug appears to be able to reverse schizophrenia in mice, researchers at Johns Hopkins Medicine have found"
110,Neuroscience,Herpes simplex virus type 1 and Alzheimer’s disease: increasing evidence for a major role of the virus
111,Medicine,"Majority of IV Medication Errors Linked to Clinical Practice, Not Technology"
112,Physical Science,"A new study describes how a simple rule guides the development of the vasculature in both animals and plants by using a mathematical model to show that this rule, known as adaptive feedback, can produce the most efficient possible network of veins for any organism."
113,Medicine,"Yale researchers have discovered a protein that helps protect hosts from infection with the tick-borne spirochete that causes Lyme Disease, a finding that may help diagnose and treat this infection. Stimulating the ability of people to make more of this protein could help fight infection."
114,Medicine,"despite recommendations from medical academies/boards, doctors spend virtually no time discussing sex (or sexuality or birth control issues) with teen patients"
115,Physical Science,Grand Canyon's origin dated to 6 million years ago
116,Medicine,Inside Hepatitis C virus is a promising antiviral. New studies show how it works.
117,Psychology,"People who endorse right-wing authoritarianism tend to have a greater sense of meaning in life, according to a new study on 2,391 American adults, which provides some of the first empirical evidence that right‐wing authoritarianism serves an existential function."
118,Environment,Creatures in the deepest trenches of the sea are eating plastic
119,Biology,Bacteria that live deeply buried point at the possibility that Evolution may occur even without reproduction: all it takes is that you live long enough
120,Physical Science,One-way light beam can be steered in different directions
121,Medicine,Cancer death rates are falling; five-year survival rates are rising
122,Biology,Low protein-high carb diet has same beneficial effects on metabolic health as caloric restriction in mice - without need for 40% decrease in energy intake.
123,Social Science,A study finds that atheists and nonreligious people do not differ from religious people in feelings of nihilism or fatalism and are more likely to believe that meaning in life is self-produced.
124,Social Science,'Little Foot' fossil sheds light on human forerunners: A sophisticated new dating technique has shown that Little Foot - an important early hominid fossil unearthed in the 1990s in South Africa - is roughly 3.7 million years old.
125,Psychology,Study of first-time smartphone users reveals devices may be detrimental to learning process
126,Medicine,Researchers have identified a drug that could potentially help our brains reboot and reverse the damaging impacts of heavy alcohol consumption on regeneration of brain cells. Two weeks of daily treatment with tandospirone reversed effects of 15 weeks of binge-like alcohol consumption in mice.
127,Medicine,Vitamin E may delay decline in mild-to-moderate Alzheimer’s disease: Study shows benefit in activities of daily living and savings in caregiver time with vitamin E
128,Psychology,Perception of time slows down when white people who are concerned about appearing racially biased are perceiving black faces
129,Physical Science,"Plants absorb nanoplastics through the roots, which block proper absorption of water, hinder growth, and harm seedling development. Worse, plastic alters the RNA sequence, hurting the plant’s ability to resist disease."
130,Neuroscience,Memory editing by epigenetic manipulation
131,Physical Science,Biochemists devise new technique for blueprinting cell membrane proteins
132,Medicine,Gut microbiota from multiple sclerosis patients enables spontaneous autoimmune encephalomyelitis in mice
133,Psychology,Chronic fatigue syndrome - The male disorder that became a female disorder: Previously long-term fatigue was considered a male disorder caused by societal pressures; today women comprise the majority of the patients
134,Astronomy,Scientists predict Earth-like planets around most stars
135,Neuroscience,MIT researchers have discovered where memories are stored.
136,Neuroscience,"For the first time researchers have identified the lifelong changes in gene expression in the brains of people born with Down syndrome (DS). The findings, which appear in the journal Neuron, may lead to possible therapies for DS patients."
137,Medicine,Research finds further evidence of a link between prenatal acetaminophen usage and attention deficit hyperactivity disorder. The children of mothers who had used acetaminophen for 29 days had more than double the risk of developing ADHD.
138,Psychology,Why ‘playing hard to get’ may actually work. People who are too easy to attract may be perceived as more desperate. That makes them seem less valuable and appealing—than those who do not make their romantic interest apparent right away.
139,Computer Science and Engineering,A team at Harvard has created a system that uses solar energy to split water molecules and hydrogen-eating bacteria to produce liquid fuels.
140,Biology,"Coronavirus antibodies fall dramatically in first 3 months after mild cases of COVID-19 according to new UCLA study. Decreasing by roughly half every 73 days. If sustained at that rate, the antibodies would disappear within about a year"
141,Animal Science,Even cockroaches have personalities
142,Physical Science,Dehydration of chlorite explains anomalously high electrical conductivity in the mantle wedges
143,Health,Study of Biggest Loser contestants finds that body returns to original or greater weight after diet due to slower resting metabolism and lowered leptin levels
144,Astronomy,The Last Thing Japan's Lost Black Hole Satellite Saw Before It Died
145,Environment,"Modified bacteria could protect crops and replace man-made pesticides - Beneficial bacteria that co-evolved with plants May have a key role to play in sustainable future, finds a new study in Nature Microbiology."
146,Psychology,"Study Says Musical Ability Determined By Genetics, Not Hours Of Practice"
147,Psychology,"Study finds Misinformation and disproportionate sensationalist or graphic news, and ambiguity in the news leads to inappropriate public health behavior and negative affect."
148,Medicine,"A new skin patch can reduce peanut allergies. After one year of wearing the patch, roughly 50% of patients showed an increased tolerance to eating peanuts."
149,Astronomy,"Sun Unleashes Strongest Solar Flare of Past Decade - The X-class flare was the most powerful seen since 2006, and created radio blackouts on Earth"
150,Psychology,"Children with greater parent communication in early adolescence may have less harmful alcohol use and emotional eating in young adulthood, and may have enhanced brain development, according to a new study in Biological Psychiatry."
151,Animal Science,"""Scientists have created the perfect music for cats"""
152,Neuroscience,"Marijuana use dampens brain’s response to reward over time, study finds"
153,Physical Science,"Our carbon budget just became significantly smaller as new research finds a significant positive feedback to future climate warming. Warming triggers more intense El Niños, triggering more intense peat bog fires across Equatorial Asia releasing more stored carbon, which increases warming."
154,Health,"Scientists designed a paper-based device that can continuously analyze a person's sweat for more than ten days. Sweat analysis can track at least seven crucial health metrics, ranging from dehydration to cystic fibrosis."
